inspire/qb-ilm2/project/26summer-camp-01/26210834/26210653/zijinhua/.vllm_cache_reflection/torch_compile/triton/0/LEXVV275AFR47ZPZNNMNN3BVYOKQRQY6KUIOUTBV2CUW22NEAIMQ/chunk_local_cumsum_scalar_kernel.autotune.json
{"key": [1, 32, 64, true, false, "torch.float32", "torch.float32", "torch.int32", "torch.int32"], "configs_timings": [[{"kwargs": {}, "num_warps": 1, "num_ctas": 1, "num_stages": 3, "maxnreg": null, "pre_hook": null, "ir_override": null}, [0.008191999979317188, 0.008191999979317188, 0.008191999979317188]], [{"kwargs": {}, "num_warps": 2, "num_ctas": 1, "num_stages": 3, "maxnreg": null, "pre_hook": null, "ir_override": null}, [0.0071680000983178616, 0.0071680000983178616, 0.008191999979317188]], [{"kwargs": {}, "num_warps": 4, "num_ctas": 1, "num_stages": 3, "maxnreg": null, "pre_hook": null, "ir_override": null}, [0.0071680000983178616, 0.0071680000983178616, 0.0071680000983178616]], [{"kwargs": {}, "num_warps": 8, "num_ctas": 1, "num_stages": 3, "maxnreg": null, "pre_hook": null, "ir_override": null}, [0.008191999979317188, 0.0071680000983178616, 0.008191999979317188]]]}