inspire/qb-ilm2/project/26summer-camp-01/26210834/26210653/zijinhua/.vllm_cache_reflection/torch_compile/triton/0/2P5X6NQSVF7U7JIJ56SGV3FVYIWBKNR7SIECUYPCFJPSDCJC7C6A/chunk_fwd_kernel_o.autotune.json
{"key": [32, 128, 128, 64, "torch.bfloat16", "torch.bfloat16", "torch.bfloat16", "torch.bfloat16", "torch.float32", "torch.bfloat16", "torch.int32", "torch.int32"], "configs_timings": [[{"kwargs": {"BK": 64, "BV": 64}, "num_warps": 2, "num_ctas": 1, "num_stages": 2, "maxnreg": null, "pre_hook": null, "ir_override": null}, [0.015359999611973763, 0.015359999611973763, 0.016383999958634377]], [{"kwargs": {"BK": 64, "BV": 64}, "num_warps": 2, "num_ctas": 1, "num_stages": 3, "maxnreg": null, "pre_hook": null, "ir_override": null}, [0.015359999611973763, 0.015359999611973763, 0.016383999958634377]], [{"kwargs": {"BK": 64, "BV": 64}, "num_warps": 2, "num_ctas": 1, "num_stages": 4, "maxnreg": null, "pre_hook": null, "ir_override": null}, [0.015359999611973763, 0.014336000196635723, 0.015359999611973763]], [{"kwargs": {"BK": 64, "BV": 64}, "num_warps": 4, "num_ctas": 1, "num_stages": 2, "maxnreg": null, "pre_hook": null, "ir_override": null}, [0.014336000196635723, 0.013311999849975109, 0.014336000196635723]], [{"kwargs": {"BK": 64, "BV": 64}, "num_warps": 4, "num_ctas": 1, "num_stages": 3, "maxnreg": null, "pre_hook": null, "ir_override": null}, [0.014336000196635723, 0.013311999849975109, 0.014336000196635723]], [{"kwargs": {"BK": 64, "BV": 64}, "num_warps": 4, "num_ctas": 1, "num_stages": 4, "maxnreg": null, "pre_hook": null, "ir_override": null}, [0.014336000196635723, 0.013311999849975109, 0.014336000196635723]], [{"kwargs": {"BK": 64, "BV": 64}, "num_warps": 8, "num_ctas": 1, "num_stages": 2, "maxnreg": null, "pre_hook": null, "ir_override": null}, [0.015359999611973763, 0.014336000196635723, 0.015359999611973763]], [{"kwargs": {"BK": 64, "BV": 64}, "num_warps": 8, "num_ctas": 1, "num_stages": 3, "maxnreg": null, "pre_hook": null, "ir_override": null}, [0.014336000196635723, 0.014336000196635723, 0.014336000196635723]], [{"kwargs": {"BK": 64, "BV": 64}, "num_warps": 8, "num_ctas": 1, "num_stages": 4, "maxnreg": null, "pre_hook": null, "ir_override": null}, [0.015359999611973763, 0.014336000196635723, 0.015359999611973763]], [{"kwargs": {"BK": 64, "BV": 128}, "num_warps": 2, "num_ctas": 1, "num_stages": 2, "maxnreg": null, "pre_hook": null, "ir_override": null}, [0.02457600086927414, 0.023552000522613525, 0.02457600086927414]], [{"kwargs": {"BK": 64, "BV": 128}, "num_warps": 2, "num_ctas": 1, "num_stages": 3, "maxnreg": null, "pre_hook": null, "ir_override": null}, [0.021503999829292297, 0.021503999829292297, 0.02252800017595291]], [{"kwargs": {"BK": 64, "BV": 128}, "num_warps": 2, "num_ctas": 1, "num_stages": 4, "maxnreg": null, "pre_hook": null, "ir_override": null}, [0.02457600086927414, 0.023552000522613525, 0.02457600086927414]], [{"kwargs": {"BK": 64, "BV": 128}, "num_warps": 4, "num_ctas": 1, "num_stages": 2, "maxnreg": null, "pre_hook": null, "ir_override": null}, [0.01740800030529499, 0.01740800030529499, 0.01740800030529499]], [{"kwargs": {"BK": 64, "BV": 128}, "num_warps": 4, "num_ctas": 1, "num_stages": 3, "maxnreg": null, "pre_hook": null, "ir_override": null}, [0.016383999958634377, 0.016383999958634377, 0.01740800030529499]], [{"kwargs": {"BK": 64, "BV": 128}, "num_warps": 4, "num_ctas": 1, "num_stages": 4, "maxnreg": null, "pre_hook": null, "ir_override": null}, [0.01740800030529499, 0.016383999958634377, 0.01740800030529499]], [{"kwargs": {"BK": 64, "BV": 128}, "num_warps": 8, "num_ctas": 1, "num_stages": 2, "maxnreg": null, "pre_hook": null, "ir_override": null}, [0.018432000651955605, 0.018432000651955605, 0.01945599913597107]], [{"kwargs": {"BK": 64, "BV": 128}, "num_warps": 8, "num_ctas": 1, "num_stages": 3, "maxnreg": null, "pre_hook": null, "ir_override": null}, [0.016383999958634377, 0.016383999958634377, 0.01740800030529499]], [{"kwargs": {"BK": 64, "BV": 128}, "num_warps": 8, "num_ctas": 1, "num_stages": 4, "maxnreg": null, "pre_hook": null, "ir_override": null}, [0.01740800030529499, 0.016383999958634377, 0.018432000651955605]], [{"kwargs": {"BK": 128, "BV": 64}, "num_warps": 2, "num_ctas": 1, "num_stages": 2, "maxnreg": null, "pre_hook": null, "ir_override": null}, [0.015359999611973763, 0.015359999611973763, 0.015359999611973763]], [{"kwargs": {"BK": 128, "BV": 64}, "num_warps": 2, "num_ctas": 1, "num_stages": 3, "maxnreg": null, "pre_hook": null, "ir_override": null}, [0.015359999611973763, 0.015359999611973763, 0.015359999611973763]], [{"kwargs": {"BK": 128, "BV": 64}, "num_warps": 2, "num_ctas": 1, "num_stages": 4, "maxnreg": null, "pre_hook": null, "ir_override": null}, [0.015359999611973763, 0.015359999611973763, 0.015359999611973763]], [{"kwargs": {"BK": 128, "BV": 64}, "num_warps": 4, "num_ctas": 1, "num_stages": 2, "maxnreg": null, "pre_hook": null, "ir_override": null}, [0.013311999849975109, 0.013311999849975109, 0.013311999849975109]], [{"kwargs": {"BK": 128, "BV": 64}, "num_warps": 4, "num_ctas": 1, "num_stages": 3, "maxnreg": null, "pre_hook": null, "ir_override": null}, [0.014336000196635723, 0.013311999849975109, 0.014336000196635723]], [{"kwargs": {"BK": 128, "BV": 64}, "num_warps": 4, "num_ctas": 1, "num_stages": 4, "maxnreg": null, "pre_hook": null, "ir_override": null}, [0.013311999849975109, 0.013311999849975109, 0.013311999849975109]], [{"kwargs": {"BK": 128, "BV": 64}, "num_warps": 8, "num_ctas": 1, "num_stages": 2, "maxnreg": null, "pre_hook": null, "ir_override": null}, [0.014336000196635723, 0.014336000196635723, 0.014336000196635723]], [{"kwargs": {"BK": 128, "BV": 64}, "num_warps": 8, "num_ctas": 1, "num_stages": 3, "maxnreg": null, "pre_hook": null, "ir_override": null}, [0.014336000196635723, 0.014336000196635723, 0.014336000196635723]], [{"kwargs": {"BK": 128, "BV": 64}, "num_warps": 8, "num_ctas": 1, "num_stages": 4, "maxnreg": null, "pre_hook": null, "ir_override": null}, [0.014336000196635723, 0.014336000196635723, 0.014336000196635723]], [{"kwargs": {"BK": 128, "BV": 128}, "num_warps": 2, "num_ctas": 1, "num_stages": 2, "maxnreg": null, "pre_hook": null, "ir_override": null}, [0.021503999829292297, 0.020479999482631683, 0.02252800017595291]], [{"kwargs": {"BK": 128, "BV": 128}, "num_warps": 2, "num_ctas": 1, "num_stages": 3, "maxnreg": null, "pre_hook": null, "ir_override": null}, [0.020479999482631683, 0.020479999482631683, 0.021503999829292297]], [{"kwargs": {"BK": 128, "BV": 128}, "num_warps": 2, "num_ctas": 1, "num_stages": 4, "maxnreg": null, "pre_hook": null, "ir_override": null}, [0.025599999353289604, 0.02457600086927414, 0.025599999353289604]], [{"kwargs": {"BK": 128, "BV": 128}, "num_warps": 4, "num_ctas": 1, "num_stages": 2, "maxnreg": null, "pre_hook": null, "ir_override": null}, [0.01740800030529499, 0.016383999958634377, 0.01740800030529499]], [{"kwargs": {"BK": 128, "BV": 128}, "num_warps": 4, "num_ctas": 1, "num_stages": 3, "maxnreg": null, "pre_hook": null, "ir_override": null}, [0.015359999611973763, 0.015359999611973763, 0.016383999958634377]], [{"kwargs": {"BK": 128, "BV": 128}, "num_warps": 4, "num_ctas": 1, "num_stages": 4, "maxnreg": null, "pre_hook": null, "ir_override": null}, [0.015359999611973763, 0.014336000196635723, 0.015359999611973763]], [{"kwargs": {"BK": 128, "BV": 128}, "num_warps": 8, "num_ctas": 1, "num_stages": 2, "maxnreg": null, "pre_hook": null, "ir_override": null}, [0.013311999849975109, 0.013311999849975109, 0.014336000196635723]], [{"kwargs": {"BK": 128, "BV": 128}, "num_warps": 8, "num_ctas": 1, "num_stages": 3, "maxnreg": null, "pre_hook": null, "ir_override": null}, [0.013311999849975109, 0.013311999849975109, 0.014336000196635723]], [{"kwargs": {"BK": 128, "BV": 128}, "num_warps": 8, "num_ctas": 1, "num_stages": 4, "maxnreg": null, "pre_hook": null, "ir_override": null}, [0.014336000196635723, 0.013311999849975109, 0.014336000196635723]]]}