inspire/qb-ilm2/project/26summer-camp-01/26210834/26210653/zijinhua/.vllm_cache_reflection/torch_compile/triton/0/WGE3EI7LOACU2G3QPAUPUHAGB5AMHWBYMBLXZIKB5E3JFSRFGU2A/chunk_fwd_kernel_o.autotune.json
{"key": [32, 128, 128, 16, "torch.bfloat16", "torch.bfloat16", "torch.bfloat16", "torch.bfloat16", "torch.float32", "torch.bfloat16", "torch.int32", "torch.int32"], "configs_timings": [[{"kwargs": {"BK": 64, "BV": 64}, "num_warps": 2, "num_ctas": 1, "num_stages": 2, "maxnreg": null, "pre_hook": null, "ir_override": null}, [0.01228800043463707, 0.01228800043463707, 0.013311999849975109]], [{"kwargs": {"BK": 64, "BV": 64}, "num_warps": 2, "num_ctas": 1, "num_stages": 3, "maxnreg": null, "pre_hook": null, "ir_override": null}, [0.011264000087976456, 0.011264000087976456, 0.01228800043463707]], [{"kwargs": {"BK": 64, "BV": 64}, "num_warps": 2, "num_ctas": 1, "num_stages": 4, "maxnreg": null, "pre_hook": null, "ir_override": null}, [0.011264000087976456, 0.010239999741315842, 0.011264000087976456]], [{"kwargs": {"BK": 64, "BV": 64}, "num_warps": 4, "num_ctas": 1, "num_stages": 2, "maxnreg": null, "pre_hook": null, "ir_override": null}, [0.011264000087976456, 0.011264000087976456, 0.01228800043463707]], [{"kwargs": {"BK": 64, "BV": 64}, "num_warps": 4, "num_ctas": 1, "num_stages": 3, "maxnreg": null, "pre_hook": null, "ir_override": null}, [0.010239999741315842, 0.010239999741315842, 0.011264000087976456]], [{"kwargs": {"BK": 64, "BV": 64}, "num_warps": 4, "num_ctas": 1, "num_stages": 4, "maxnreg": null, "pre_hook": null, "ir_override": null}, [0.010239999741315842, 0.010239999741315842, 0.011264000087976456]], [{"kwargs": {"BK": 64, "BV": 64}, "num_warps": 8, "num_ctas": 1, "num_stages": 2, "maxnreg": null, "pre_hook": null, "ir_override": null}, [0.011264000087976456, 0.011264000087976456, 0.01228800043463707]], [{"kwargs": {"BK": 64, "BV": 64}, "num_warps": 8, "num_ctas": 1, "num_stages": 3, "maxnreg": null, "pre_hook": null, "ir_override": null}, [0.01228800043463707, 0.01228800043463707, 0.013311999849975109]], [{"kwargs": {"BK": 64, "BV": 64}, "num_warps": 8, "num_ctas": 1, "num_stages": 4, "maxnreg": null, "pre_hook": null, "ir_override": null}, [0.01228800043463707, 0.011264000087976456, 0.01228800043463707]], [{"kwargs": {"BK": 64, "BV": 128}, "num_warps": 2, "num_ctas": 1, "num_stages": 2, "maxnreg": null, "pre_hook": null, "ir_override": null}, [0.01228800043463707, 0.011264000087976456, 0.01269760020077232]], [{"kwargs": {"BK": 64, "BV": 128}, "num_warps": 2, "num_ctas": 1, "num_stages": 3, "maxnreg": null, "pre_hook": null, "ir_override": null}, [0.011264000087976456, 0.011264000087976456, 0.011264000087976456]], [{"kwargs": {"BK": 64, "BV": 128}, "num_warps": 2, "num_ctas": 1, "num_stages": 4, "maxnreg": null, "pre_hook": null, "ir_override": null}, [0.011264000087976456, 0.011264000087976456, 0.01228800043463707]], [{"kwargs": {"BK": 64, "BV": 128}, "num_warps": 4, "num_ctas": 1, "num_stages": 2, "maxnreg": null, "pre_hook": null, "ir_override": null}, [0.01228800043463707, 0.01228800043463707, 0.01228800043463707]], [{"kwargs": {"BK": 64, "BV": 128}, "num_warps": 4, "num_ctas": 1, "num_stages": 3, "maxnreg": null, "pre_hook": null, "ir_override": null}, [0.01228800043463707, 0.011264000087976456, 0.013311999849975109]], [{"kwargs": {"BK": 64, "BV": 128}, "num_warps": 4, "num_ctas": 1, "num_stages": 4, "maxnreg": null, "pre_hook": null, "ir_override": null}, [0.011264000087976456, 0.011264000087976456, 0.01228800043463707]], [{"kwargs": {"BK": 64, "BV": 128}, "num_warps": 8, "num_ctas": 1, "num_stages": 2, "maxnreg": null, "pre_hook": null, "ir_override": null}, [0.013311999849975109, 0.01228800043463707, 0.013311999849975109]], [{"kwargs": {"BK": 64, "BV": 128}, "num_warps": 8, "num_ctas": 1, "num_stages": 3, "maxnreg": null, "pre_hook": null, "ir_override": null}, [0.01228800043463707, 0.01228800043463707, 0.013311999849975109]], [{"kwargs": {"BK": 64, "BV": 128}, "num_warps": 8, "num_ctas": 1, "num_stages": 4, "maxnreg": null, "pre_hook": null, "ir_override": null}, [0.01228800043463707, 0.01228800043463707, 0.013311999849975109]], [{"kwargs": {"BK": 128, "BV": 64}, "num_warps": 2, "num_ctas": 1, "num_stages": 2, "maxnreg": null, "pre_hook": null, "ir_override": null}, [0.011264000087976456, 0.010239999741315842, 0.01228800043463707]], [{"kwargs": {"BK": 128, "BV": 64}, "num_warps": 2, "num_ctas": 1, "num_stages": 3, "maxnreg": null, "pre_hook": null, "ir_override": null}, [0.011264000087976456, 0.010239999741315842, 0.01228800043463707]], [{"kwargs": {"BK": 128, "BV": 64}, "num_warps": 2, "num_ctas": 1, "num_stages": 4, "maxnreg": null, "pre_hook": null, "ir_override": null}, [0.011264000087976456, 0.010239999741315842, 0.01228800043463707]], [{"kwargs": {"BK": 128, "BV": 64}, "num_warps": 4, "num_ctas": 1, "num_stages": 2, "maxnreg": null, "pre_hook": null, "ir_override": null}, [0.010239999741315842, 0.010239999741315842, 0.010239999741315842]], [{"kwargs": {"BK": 128, "BV": 64}, "num_warps": 4, "num_ctas": 1, "num_stages": 3, "maxnreg": null, "pre_hook": null, "ir_override": null}, [0.010239999741315842, 0.010239999741315842, 0.011264000087976456]], [{"kwargs": {"BK": 128, "BV": 64}, "num_warps": 4, "num_ctas": 1, "num_stages": 4, "maxnreg": null, "pre_hook": null, "ir_override": null}, [0.010239999741315842, 0.010239999741315842, 0.010239999741315842]], [{"kwargs": {"BK": 128, "BV": 64}, "num_warps": 8, "num_ctas": 1, "num_stages": 2, "maxnreg": null, "pre_hook": null, "ir_override": null}, [0.011264000087976456, 0.01085439994931222, 0.01228800043463707]], [{"kwargs": {"BK": 128, "BV": 64}, "num_warps": 8, "num_ctas": 1, "num_stages": 3, "maxnreg": null, "pre_hook": null, "ir_override": null}, [0.011264000087976456, 0.010239999741315842, 0.01228800043463707]], [{"kwargs": {"BK": 128, "BV": 64}, "num_warps": 8, "num_ctas": 1, "num_stages": 4, "maxnreg": null, "pre_hook": null, "ir_override": null}, [0.011264000087976456, 0.010239999741315842, 0.011264000087976456]], [{"kwargs": {"BK": 128, "BV": 128}, "num_warps": 2, "num_ctas": 1, "num_stages": 2, "maxnreg": null, "pre_hook": null, "ir_override": null}, [0.011264000087976456, 0.011264000087976456, 0.01228800043463707]], [{"kwargs": {"BK": 128, "BV": 128}, "num_warps": 2, "num_ctas": 1, "num_stages": 3, "maxnreg": null, "pre_hook": null, "ir_override": null}, [0.011264000087976456, 0.011264000087976456, 0.01228800043463707]], [{"kwargs": {"BK": 128, "BV": 128}, "num_warps": 2, "num_ctas": 1, "num_stages": 4, "maxnreg": null, "pre_hook": null, "ir_override": null}, [0.011264000087976456, 0.010239999741315842, 0.011264000087976456]], [{"kwargs": {"BK": 128, "BV": 128}, "num_warps": 4, "num_ctas": 1, "num_stages": 2, "maxnreg": null, "pre_hook": null, "ir_override": null}, [0.011264000087976456, 0.010239999741315842, 0.011264000087976456]], [{"kwargs": {"BK": 128, "BV": 128}, "num_warps": 4, "num_ctas": 1, "num_stages": 3, "maxnreg": null, "pre_hook": null, "ir_override": null}, [0.011264000087976456, 0.010239999741315842, 0.011264000087976456]], [{"kwargs": {"BK": 128, "BV": 128}, "num_warps": 4, "num_ctas": 1, "num_stages": 4, "maxnreg": null, "pre_hook": null, "ir_override": null}, [0.011264000087976456, 0.010239999741315842, 0.011264000087976456]], [{"kwargs": {"BK": 128, "BV": 128}, "num_warps": 8, "num_ctas": 1, "num_stages": 2, "maxnreg": null, "pre_hook": null, "ir_override": null}, [0.011264000087976456, 0.010239999741315842, 0.011264000087976456]], [{"kwargs": {"BK": 128, "BV": 128}, "num_warps": 8, "num_ctas": 1, "num_stages": 3, "maxnreg": null, "pre_hook": null, "ir_override": null}, [0.011264000087976456, 0.010239999741315842, 0.011264000087976456]], [{"kwargs": {"BK": 128, "BV": 128}, "num_warps": 8, "num_ctas": 1, "num_stages": 4, "maxnreg": null, "pre_hook": null, "ir_override": null}, [0.010239999741315842, 0.010239999741315842, 0.011264000087976456]]]}