group_4/code/.vllm_cache_simplevqa/torch_compile/triton/0/UXWAQ3YEJBCEESOBPKORYKW4XPECUPFK4BR7K36N3AJSGRHEX3MA/recompute_w_u_fwd_kernel.autotune.json
{"key": [32, 128, 128, 64, 64, 64, true, "torch.bfloat16", "torch.bfloat16", "torch.bfloat16", "torch.bfloat16", "torch.bfloat16", "torch.bfloat16", "torch.float32", "torch.int32", "torch.int32"], "configs_timings": [[{"kwargs": {}, "num_warps": 2, "num_ctas": 1, "num_stages": 2, "maxnreg": null, "pre_hook": null, "ir_override": null}, [0.014336000196635723, 0.013311999849975109, 0.014336000196635723]], [{"kwargs": {}, "num_warps": 2, "num_ctas": 1, "num_stages": 3, "maxnreg": null, "pre_hook": null, "ir_override": null}, [0.013311999849975109, 0.013311999849975109, 0.013311999849975109]], [{"kwargs": {}, "num_warps": 2, "num_ctas": 1, "num_stages": 4, "maxnreg": null, "pre_hook": null, "ir_override": null}, [0.013311999849975109, 0.013311999849975109, 0.013311999849975109]], [{"kwargs": {}, "num_warps": 4, "num_ctas": 1, "num_stages": 2, "maxnreg": null, "pre_hook": null, "ir_override": null}, [0.013311999849975109, 0.01228800043463707, 0.013311999849975109]], [{"kwargs": {}, "num_warps": 4, "num_ctas": 1, "num_stages": 3, "maxnreg": null, "pre_hook": null, "ir_override": null}, [0.01228800043463707, 0.011264000087976456, 0.01228800043463707]], [{"kwargs": {}, "num_warps": 4, "num_ctas": 1, "num_stages": 4, "maxnreg": null, "pre_hook": null, "ir_override": null}, [0.01228800043463707, 0.011264000087976456, 0.01228800043463707]], [{"kwargs": {}, "num_warps": 8, "num_ctas": 1, "num_stages": 2, "maxnreg": null, "pre_hook": null, "ir_override": null}, [0.014336000196635723, 0.013311999849975109, 0.014336000196635723]], [{"kwargs": {}, "num_warps": 8, "num_ctas": 1, "num_stages": 3, "maxnreg": null, "pre_hook": null, "ir_override": null}, [0.011264000087976456, 0.011264000087976456, 0.01228800043463707]], [{"kwargs": {}, "num_warps": 8, "num_ctas": 1, "num_stages": 4, "maxnreg": null, "pre_hook": null, "ir_override": null}, [0.01228800043463707, 0.011264000087976456, 0.01228800043463707]]]}