group_4/code/.vllm_cache_reflection/torch_compile/triton/0/JS2JCJRBBXWMSJH7TV7FO3QZSSW77I2IQIUGARGEKK2GBBAHGJEQ/merge_16x16_to_64x64_inverse_kernel.autotune.json
{"key": [32, 64, true, "torch.float32", "torch.bfloat16", "torch.int32", "torch.int32"], "configs_timings": [[{"kwargs": {}, "num_warps": 2, "num_ctas": 1, "num_stages": 2, "maxnreg": null, "pre_hook": null, "ir_override": null}, [0.014336000196635723, 0.013311999849975109, 0.014336000196635723]], [{"kwargs": {}, "num_warps": 2, "num_ctas": 1, "num_stages": 3, "maxnreg": null, "pre_hook": null, "ir_override": null}, [0.01740800030529499, 0.016383999958634377, 0.01740800030529499]], [{"kwargs": {}, "num_warps": 2, "num_ctas": 1, "num_stages": 4, "maxnreg": null, "pre_hook": null, "ir_override": null}, [0.014336000196635723, 0.013311999849975109, 0.014336000196635723]], [{"kwargs": {}, "num_warps": 2, "num_ctas": 1, "num_stages": 5, "maxnreg": null, "pre_hook": null, "ir_override": null}, [0.014336000196635723, 0.014336000196635723, 0.015359999611973763]], [{"kwargs": {}, "num_warps": 4, "num_ctas": 1, "num_stages": 2, "maxnreg": null, "pre_hook": null, "ir_override": null}, [0.013311999849975109, 0.013311999849975109, 0.014336000196635723]], [{"kwargs": {}, "num_warps": 4, "num_ctas": 1, "num_stages": 3, "maxnreg": null, "pre_hook": null, "ir_override": null}, [0.013311999849975109, 0.013311999849975109, 0.014336000196635723]], [{"kwargs": {}, "num_warps": 4, "num_ctas": 1, "num_stages": 4, "maxnreg": null, "pre_hook": null, "ir_override": null}, [0.014336000196635723, 0.013311999849975109, 0.014336000196635723]], [{"kwargs": {}, "num_warps": 4, "num_ctas": 1, "num_stages": 5, "maxnreg": null, "pre_hook": null, "ir_override": null}, [0.014336000196635723, 0.013311999849975109, 0.015359999611973763]], [{"kwargs": {}, "num_warps": 8, "num_ctas": 1, "num_stages": 2, "maxnreg": null, "pre_hook": null, "ir_override": null}, [0.013311999849975109, 0.013311999849975109, 0.013311999849975109]], [{"kwargs": {}, "num_warps": 8, "num_ctas": 1, "num_stages": 3, "maxnreg": null, "pre_hook": null, "ir_override": null}, [0.013311999849975109, 0.013311999849975109, 0.013311999849975109]], [{"kwargs": {}, "num_warps": 8, "num_ctas": 1, "num_stages": 4, "maxnreg": null, "pre_hook": null, "ir_override": null}, [0.013311999849975109, 0.013311999849975109, 0.013311999849975109]], [{"kwargs": {}, "num_warps": 8, "num_ctas": 1, "num_stages": 5, "maxnreg": null, "pre_hook": null, "ir_override": null}, [0.014336000196635723, 0.013311999849975109, 0.014336000196635723]]]}