inspire/qb-ilm2/project/26summer-camp-01/26210834/26210653/zijinhua/.vllm_cache_simplevqa/torch_compile/triton/0/DEBDTM3OVWZTZDE33CWL2EQL4VJQA24JJ6EOI3TS5QFBVF4T4YWA/chunk_scaled_dot_kkt_fwd_kernel.autotune.json
{"key": [32, 128, 64, true, "torch.bfloat16", "torch.float32", "torch.bfloat16", "torch.float32", "torch.int32", "torch.int32"], "configs_timings": [[{"kwargs": {"BK": 32}, "num_warps": 2, "num_ctas": 1, "num_stages": 2, "maxnreg": null, "pre_hook": null, "ir_override": null}, [0.01228800043463707, 0.01228800043463707, 0.01228800043463707]], [{"kwargs": {"BK": 32}, "num_warps": 2, "num_ctas": 1, "num_stages": 3, "maxnreg": null, "pre_hook": null, "ir_override": null}, [0.011264000087976456, 0.011264000087976456, 0.01228800043463707]], [{"kwargs": {"BK": 32}, "num_warps": 2, "num_ctas": 1, "num_stages": 4, "maxnreg": null, "pre_hook": null, "ir_override": null}, [0.011264000087976456, 0.011264000087976456, 0.01228800043463707]], [{"kwargs": {"BK": 32}, "num_warps": 4, "num_ctas": 1, "num_stages": 2, "maxnreg": null, "pre_hook": null, "ir_override": null}, [0.01228800043463707, 0.011264000087976456, 0.01228800043463707]], [{"kwargs": {"BK": 32}, "num_warps": 4, "num_ctas": 1, "num_stages": 3, "maxnreg": null, "pre_hook": null, "ir_override": null}, [0.010239999741315842, 0.010239999741315842, 0.010239999741315842]], [{"kwargs": {"BK": 32}, "num_warps": 4, "num_ctas": 1, "num_stages": 4, "maxnreg": null, "pre_hook": null, "ir_override": null}, [0.010239999741315842, 0.009216000325977802, 0.010239999741315842]], [{"kwargs": {"BK": 32}, "num_warps": 8, "num_ctas": 1, "num_stages": 2, "maxnreg": null, "pre_hook": null, "ir_override": null}, [0.011264000087976456, 0.011264000087976456, 0.011264000087976456]], [{"kwargs": {"BK": 32}, "num_warps": 8, "num_ctas": 1, "num_stages": 3, "maxnreg": null, "pre_hook": null, "ir_override": null}, [0.010239999741315842, 0.010239999741315842, 0.011264000087976456]], [{"kwargs": {"BK": 32}, "num_warps": 8, "num_ctas": 1, "num_stages": 4, "maxnreg": null, "pre_hook": null, "ir_override": null}, [0.009216000325977802, 0.009216000325977802, 0.010239999741315842]], [{"kwargs": {"BK": 64}, "num_warps": 2, "num_ctas": 1, "num_stages": 2, "maxnreg": null, "pre_hook": null, "ir_override": null}, [0.01228800043463707, 0.011264000087976456, 0.01228800043463707]], [{"kwargs": {"BK": 64}, "num_warps": 2, "num_ctas": 1, "num_stages": 3, "maxnreg": null, "pre_hook": null, "ir_override": null}, [0.011264000087976456, 0.010239999741315842, 0.01228800043463707]], [{"kwargs": {"BK": 64}, "num_warps": 2, "num_ctas": 1, "num_stages": 4, "maxnreg": null, "pre_hook": null, "ir_override": null}, [0.011264000087976456, 0.010444799810647968, 0.01228800043463707]], [{"kwargs": {"BK": 64}, "num_warps": 4, "num_ctas": 1, "num_stages": 2, "maxnreg": null, "pre_hook": null, "ir_override": null}, [0.011264000087976456, 0.010239999741315842, 0.011264000087976456]], [{"kwargs": {"BK": 64}, "num_warps": 4, "num_ctas": 1, "num_stages": 3, "maxnreg": null, "pre_hook": null, "ir_override": null}, [0.009216000325977802, 0.009216000325977802, 0.010239999741315842]], [{"kwargs": {"BK": 64}, "num_warps": 4, "num_ctas": 1, "num_stages": 4, "maxnreg": null, "pre_hook": null, "ir_override": null}, [0.009216000325977802, 0.009216000325977802, 0.010239999741315842]], [{"kwargs": {"BK": 64}, "num_warps": 8, "num_ctas": 1, "num_stages": 2, "maxnreg": null, "pre_hook": null, "ir_override": null}, [0.010239999741315842, 0.009216000325977802, 0.010239999741315842]], [{"kwargs": {"BK": 64}, "num_warps": 8, "num_ctas": 1, "num_stages": 3, "maxnreg": null, "pre_hook": null, "ir_override": null}, [0.009216000325977802, 0.009216000325977802, 0.010239999741315842]], [{"kwargs": {"BK": 64}, "num_warps": 8, "num_ctas": 1, "num_stages": 4, "maxnreg": null, "pre_hook": null, "ir_override": null}, [0.010239999741315842, 0.009216000325977802, 0.010239999741315842]], [{"kwargs": {"BK": 128}, "num_warps": 2, "num_ctas": 1, "num_stages": 2, "maxnreg": null, "pre_hook": null, "ir_override": null}, [0.011264000087976456, 0.010239999741315842, 0.011264000087976456]], [{"kwargs": {"BK": 128}, "num_warps": 2, "num_ctas": 1, "num_stages": 3, "maxnreg": null, "pre_hook": null, "ir_override": null}, [0.011264000087976456, 0.010239999741315842, 0.01228800043463707]], [{"kwargs": {"BK": 128}, "num_warps": 2, "num_ctas": 1, "num_stages": 4, "maxnreg": null, "pre_hook": null, "ir_override": null}, [0.011264000087976456, 0.011264000087976456, 0.01228800043463707]], [{"kwargs": {"BK": 128}, "num_warps": 4, "num_ctas": 1, "num_stages": 2, "maxnreg": null, "pre_hook": null, "ir_override": null}, [0.010239999741315842, 0.010239999741315842, 0.011264000087976456]], [{"kwargs": {"BK": 128}, "num_warps": 4, "num_ctas": 1, "num_stages": 3, "maxnreg": null, "pre_hook": null, "ir_override": null}, [0.010239999741315842, 0.010239999741315842, 0.011264000087976456]], [{"kwargs": {"BK": 128}, "num_warps": 4, "num_ctas": 1, "num_stages": 4, "maxnreg": null, "pre_hook": null, "ir_override": null}, [0.011264000087976456, 0.010239999741315842, 0.011264000087976456]], [{"kwargs": {"BK": 128}, "num_warps": 8, "num_ctas": 1, "num_stages": 2, "maxnreg": null, "pre_hook": null, "ir_override": null}, [0.009216000325977802, 0.009216000325977802, 0.010239999741315842]], [{"kwargs": {"BK": 128}, "num_warps": 8, "num_ctas": 1, "num_stages": 3, "maxnreg": null, "pre_hook": null, "ir_override": null}, [0.009216000325977802, 0.009216000325977802, 0.010239999741315842]], [{"kwargs": {"BK": 128}, "num_warps": 8, "num_ctas": 1, "num_stages": 4, "maxnreg": null, "pre_hook": null, "ir_override": null}, [0.010239999741315842, 0.009216000325977802, 0.011264000087976456]]]}