inspire/qb-ilm2/project/26summer-camp-01/26210834/26210653/zijinhua/.vllm_cache_reflection/torch_compile/triton/0/P6QVHH2MAEQCN5ORCHK47SKDWX6SLXXWUAJMA47MX2JDRW3BXAEQ/chunk_gated_delta_rule_fwd_kernel_h_blockdim64.autotune.json
{"key": [32, 128, 128, 64, "torch.bfloat16", "torch.bfloat16", "torch.bfloat16", "torch.bfloat16", "torch.float32", "torch.bfloat16", "torch.float32", "torch.float32", "torch.int32", "torch.int64"], "configs_timings": [[{"kwargs": {"BV": 32}, "num_warps": 2, "num_ctas": 1, "num_stages": 2, "maxnreg": null, "pre_hook": null, "ir_override": null}, [0.015359999611973763, 0.014336000196635723, 0.015359999611973763]], [{"kwargs": {"BV": 64}, "num_warps": 2, "num_ctas": 1, "num_stages": 2, "maxnreg": null, "pre_hook": null, "ir_override": null}, [0.018432000651955605, 0.018432000651955605, 0.01945599913597107]], [{"kwargs": {"BV": 32}, "num_warps": 2, "num_ctas": 1, "num_stages": 3, "maxnreg": null, "pre_hook": null, "ir_override": null}, [0.016383999958634377, 0.015359999611973763, 0.016383999958634377]], [{"kwargs": {"BV": 64}, "num_warps": 2, "num_ctas": 1, "num_stages": 3, "maxnreg": null, "pre_hook": null, "ir_override": null}, [0.026623999699950218, 0.026623999699950218, 0.027648000046610832]], [{"kwargs": {"BV": 32}, "num_warps": 2, "num_ctas": 1, "num_stages": 4, "maxnreg": null, "pre_hook": null, "ir_override": null}, [0.025599999353289604, 0.02457600086927414, 0.026623999699950218]], [{"kwargs": {"BV": 64}, "num_warps": 2, "num_ctas": 1, "num_stages": 4, "maxnreg": null, "pre_hook": null, "ir_override": null}, [0.030719999223947525, 0.02969600073993206, 0.030719999223947525]], [{"kwargs": {"BV": 32}, "num_warps": 4, "num_ctas": 1, "num_stages": 2, "maxnreg": null, "pre_hook": null, "ir_override": null}, [0.014336000196635723, 0.013311999849975109, 0.015359999611973763]], [{"kwargs": {"BV": 64}, "num_warps": 4, "num_ctas": 1, "num_stages": 2, "maxnreg": null, "pre_hook": null, "ir_override": null}, [0.014336000196635723, 0.014336000196635723, 0.014336000196635723]], [{"kwargs": {"BV": 32}, "num_warps": 4, "num_ctas": 1, "num_stages": 3, "maxnreg": null, "pre_hook": null, "ir_override": null}, [0.015359999611973763, 0.014336000196635723, 0.015359999611973763]], [{"kwargs": {"BV": 64}, "num_warps": 4, "num_ctas": 1, "num_stages": 3, "maxnreg": null, "pre_hook": null, "ir_override": null}, [0.014336000196635723, 0.014336000196635723, 0.015359999611973763]], [{"kwargs": {"BV": 32}, "num_warps": 4, "num_ctas": 1, "num_stages": 4, "maxnreg": null, "pre_hook": null, "ir_override": null}, [0.018432000651955605, 0.01740800030529499, 0.018432000651955605]], [{"kwargs": {"BV": 64}, "num_warps": 4, "num_ctas": 1, "num_stages": 4, "maxnreg": null, "pre_hook": null, "ir_override": null}, [0.01740800030529499, 0.01740800030529499, 0.01740800030529499]]]}